,File_Name,Content,Category,Content_Parsed,Category_Code
170,QC-Chain,"QC-Chain: Fast and Holistic Quality Control Method for Next-Generation Sequencing Data
Next-generation sequencing (NGS) technologies have been widely used in life sciences. However, several kinds of sequencing artifacts, including low-quality reads and contaminating reads, were found to be quite common in raw sequencing data, which compromise downstream analysis. Therefore, quality control (QC) is essential for raw NGS data. However, although a few NGS data quality control tools are publicly available, there are two limitations: First, the processing speed could not cope with the rapid increase of large data volume. Second, with respect to removing the contaminating reads, none of them could identify contaminating sources de novo, and they rely heavily on prior information of the contaminating species, which is usually not available in advance. Here we report QC-Chain, a fast, accurate and holistic NGS data quality-control method. The tool synergeticly comprised of user-friendly tools for (1) quality assessment and trimming of raw reads using Parallel-QC, a fast read processing tool; (2) identification, quantification and filtration of unknown contamination to get high-quality clean reads. It was optimized based on parallel computation, so the processing speed is significantly higher than other QC methods. Experiments on simulated and real NGS data have shown that reads with low sequencing quality could be identified and filtered. Possible contaminating sources could be identified and quantified de novo, accurately and quickly. Comparison between raw reads and processed reads also showed that subsequent analyses (genome assembly, gene prediction, gene annotation, etc.) results based on processed reads improved significantly in completeness and accuracy. As regard to processing speed, QC-Chain achieves 7–8 time speed-up based on parallel computation as compared to traditional methods. Therefore, QC-Chain is a fast and useful quality control tool for read quality process and de novo contamination filtration of NGS reads, which could significantly facilitate downstream analysis.",QualityControl,"qcchain fast  holistic quality control method  nextgeneration sequence data
nextgeneration sequence ngs technologies   widely use  life sciences however several kinds  sequence artifacts include lowquality read  contaminate read  find   quite common  raw sequence data  compromise downstream analysis therefore quality control   essential  raw ngs data however although   ngs data quality control tool  publicly available   two limitations first  process speed could  cope   rapid increase  large data volume second  respect  remove  contaminate read none   could identify contaminate source  novo   rely heavily  prior information   contaminate species   usually  available  advance   report qcchain  fast accurate  holistic ngs data qualitycontrol method  tool synergeticly comprise  userfriendly tool   quality assessment  trim  raw read use parallelqc  fast read process tool  identification quantification  filtration  unknown contamination  get highquality clean read   optimize base  parallel computation   process speed  significantly higher    methods experiment  simulate  real ngs data  show  read  low sequence quality could  identify  filter possible contaminate source could  identify  quantify  novo accurately  quickly comparison  raw read  process read also show  subsequent analyse genome assembly gene prediction gene annotation etc result base  process read improve significantly  completeness  accuracy  regard  process speed qcchain achieve  time speedup base  parallel computation  compare  traditional methods therefore qcchain   fast  useful quality control tool  read quality process   novo contamination filtration  ngs read  could significantly facilitate downstream analysis",8
171,SAMStat,"SAMStat: monitoring biases in next generation sequencing data
The sequence alignment/map format (SAM) is a commonly used format to store the alignments between millions of short reads and a reference genome. Often certain positions within the reads are inherently more likely to contain errors due to the protocols used to prepare the samples. Such biases can have adverse effects on both mapping rate and accuracy. To understand the relationship between potential protocol biases and poor mapping we wrote SAMstat, a simple C program plotting nucleotide overrepresentation and other statistics in mapped and unmapped reads in a concise html page. Collecting such statistics also makes it easy to highlight problems in the data processing and enables non-experts to track data quality over time. We demonstrate that studying sequence features in mapped data can be used to identify biases particular to one sequencing protocol. Once identified, such biases can be considered in the downstream analysis or even be removed by read trimming or filtering techniques.",QualityControl,"samstat monitor bias  next generation sequence data
 sequence alignmentmap format sam   commonly use format  store  alignments  millions  short read   reference genome often certain position within  read  inherently  likely  contain errors due   protocols use  prepare  sample  bias   adverse effect   map rate  accuracy  understand  relationship  potential protocol bias  poor map  write samstat  simple  program plot nucleotide overrepresentation   statistics  map  unmapped read   concise html page collect  statistics also make  easy  highlight problems   data process  enable nonexperts  track data quality  time  demonstrate  study sequence feature  map data   use  identify bias particular  one sequence protocol  identify  bias   consider   downstream analysis  even  remove  read trim  filter techniques",8
172,ClinQC,"ClinQC: a tool for quality control and cleaning of Sanger and NGS data in clinical research
Traditional Sanger sequencing has been used as a gold standard method for genetic testing in clinic to perform single gene test, which has been a cumbersome and expensive method to test several genes in heterogeneous disease such as cancer. With the advent of Next Generation Sequencing technologies, which produce data on unprecedented speed in a cost effective manner have overcome the limitation of Sanger sequencing. Therefore, for the efficient and affordable genetic testing, Next Generation Sequencing has been used as a complementary method with Sanger sequencing for disease causing mutation identification and confirmation in clinical research. However, in order to identify the potential disease causing mutations with great sensitivity and specificity it is essential to ensure high quality sequencing data. Therefore, integrated software tools are lacking which can analyze Sanger and NGS data together and eliminate platform specific sequencing errors, low quality reads and support the analysis of several sample/patients data set in a single run. We have developed ClinQC, a flexible and user-friendly pipeline for format conversion, quality control, trimming and filtering of raw sequencing data generated from Sanger sequencing and three NGS sequencing platforms including Illumina, 454 and Ion Torrent. First, ClinQC convert input read files from their native formats to a common FASTQ format and remove adapters, and PCR primers. Next, it split bar-coded samples, filter duplicates, contamination and low quality sequences and generates a QC report. ClinQC output high quality reads in FASTQ format with Sanger quality encoding, which can be directly used in down-stream analysis. It can analyze hundreds of sample/patients data in a single run and generate unified output files for both Sanger and NGS sequencing data. Our tool is expected to be very useful for quality control and format conversion of Sanger and NGS data to facilitate improved downstream analysis and mutation screening.",QualityControl,"clinqc  tool  quality control  clean  sanger  ngs data  clinical research
traditional sanger sequence   use   gold standard method  genetic test  clinic  perform single gene test     cumbersome  expensive method  test several genes  heterogeneous disease   cancer   advent  next generation sequence technologies  produce data  unprecedented speed   cost effective manner  overcome  limitation  sanger sequence therefore   efficient  affordable genetic test next generation sequence   use   complementary method  sanger sequence  disease cause mutation identification  confirmation  clinical research however  order  identify  potential disease cause mutations  great sensitivity  specificity   essential  ensure high quality sequence data therefore integrate software tool  lack   analyze sanger  ngs data together  eliminate platform specific sequence errors low quality read  support  analysis  several samplepatients data set   single run   develop clinqc  flexible  userfriendly pipeline  format conversion quality control trim  filter  raw sequence data generate  sanger sequence  three ngs sequence platforms include illumina   ion torrent first clinqc convert input read file   native format   common fastq format  remove adapters  pcr primers next  split barcoded sample filter duplicate contamination  low quality sequence  generate   report clinqc output high quality read  fastq format  sanger quality encode    directly use  downstream analysis   analyze hundreds  samplepatients data   single run  generate unify output file   sanger  ngs sequence data  tool  expect    useful  quality control  format conversion  sanger  ngs data  facilitate improve downstream analysis  mutation screen",8
173,UrQt,"UrQt: an efficient software for the Unsupervised Quality trimming of NGS data.
Quality control is a necessary step of any Next Generation Sequencing analysis. Although customary, this step still requires manual interventions to empirically choose tuning parameters according to various quality statistics. Moreover, current quality control procedures that provide a “good quality” data set, are not optimal and discard many informative nucleotides. To address these drawbacks, we present a new quality control method, implemented in UrQt software, for Unsupervised Quality trimming of Next Generation Sequencing reads. Our trimming procedure relies on a well-defined probabilistic framework to detect the best segmentation between two segments of unreliable nucleotides, framing a segment of informative nucleotides. Our software only requires one user-friendly parameter to define the minimal quality threshold (phred score) to consider a nucleotide to be informative, which is independent of both the experiment and the quality of the data. This procedure is implemented in C++ in an efficient and parallelized software with a low memory footprint. We tested the performances of UrQt compared to the best-known trimming programs, on seven RNA and DNA sequencing experiments and demonstrated its optimality in the resulting tradeoff between the number of trimmed nucleotides and the quality objective. By finding the best segmentation to delimit a segment of good quality nucleotides, UrQt greatly increases the number of reads and of nucleotides that can be retained for a given quality objective.",QualityControl,"urqt  efficient software   unsupervised quality trim  ngs data
quality control   necessary step   next generation sequence analysis although customary  step still require manual interventions  empirically choose tune parameters accord  various quality statistics moreover current quality control procedures  provide  “good quality” data set   optimal  discard many informative nucleotides  address  drawbacks  present  new quality control method implement  urqt software  unsupervised quality trim  next generation sequence read  trim procedure rely   welldefined probabilistic framework  detect  best segmentation  two segment  unreliable nucleotides frame  segment  informative nucleotides  software  require one userfriendly parameter  define  minimal quality threshold phred score  consider  nucleotide   informative   independent    experiment   quality   data  procedure  implement     efficient  parallelize software   low memory footprint  test  performances  urqt compare   bestknown trim program  seven rna  dna sequence experiment  demonstrate  optimality   result tradeoff   number  trim nucleotides   quality objective  find  best segmentation  delimit  segment  good quality nucleotides urqt greatly increase  number  read   nucleotides    retain   give quality objective",8
174,FQC,"FQC Dashboard: integrates FastQC results into a web-based, interactive, and extensible FASTQ quality control tool
FQC is software that facilitates quality control of FASTQ files by carrying out a QC protocol using FastQC, parsing results, and aggregating quality metrics into an interactive dashboard designed to richly summarize individual sequencing runs. The dashboard groups samples in dropdowns for navigation among the data sets, utilizes human-readable configuration files to manipulate the pages and tabs, and is extensible with CSV data.",QualityControl,"fqc dashboard integrate fastqc result   webbased interactive  extensible fastq quality control tool
fqc  software  facilitate quality control  fastq file  carry    protocol use fastqc parse result  aggregate quality metrics   interactive dashboard design  richly summarize individual sequence run  dashboard group sample  dropdowns  navigation among  data set utilize humanreadable configuration file  manipulate  page  tabs   extensible  csv data",8
175,KAT,"KAT: a K-mer analysis toolkit to quality control NGS datasets and genome assemblies 
De novo assembly of whole genome shotgun (WGS) next-generation sequencing (NGS) data benefits from high-quality input with high coverage. However, in practice, determining the quality and quantity of useful reads quickly and in a reference-free manner is not trivial. Gaining a better understanding of the WGS data, and how that data is utilized by assemblers, provides useful insights that can inform the assembly process and result in better assemblies.  We present the K-mer Analysis Toolkit (KAT): a multi-purpose software toolkit for reference-free quality control (QC) of WGS reads and de novo genome assemblies, primarily via their k-mer frequencies and GC composition. KAT enables users to assess levels of errors, bias and contamination at various stages of the assembly process. In this paper we highlight KAT’s ability to provide valuable insights into assembly composition and quality of genome assemblies through pairwise comparison of k-mers present in both input reads and the assemblies",QualityControl,"kat  kmer analysis toolkit  quality control ngs datasets  genome assemblies 
 novo assembly  whole genome shotgun wgs nextgeneration sequence ngs data benefit  highquality input  high coverage however  practice determine  quality  quantity  useful read quickly    referencefree manner   trivial gain  better understand   wgs data    data  utilize  assemblers provide useful insights   inform  assembly process  result  better assemblies   present  kmer analysis toolkit kat  multipurpose software toolkit  referencefree quality control   wgs read   novo genome assemblies primarily via  kmer frequencies   composition kat enable users  assess level  errors bias  contamination  various stag   assembly process   paper  highlight kats ability  provide valuable insights  assembly composition  quality  genome assemblies  pairwise comparison  kmers present   input read   assemblies",8
176,NGS-QC generator,"NGS-QC Generator: A Quality Control System for ChIP-Seq and Related Deep Sequencing-Generated Datasets
The combination of massive parallel sequencing with a variety of modern DNA/RNA enrichment technologies provides means for interrogating functional protein–genome interactions (ChIP-seq), genome-wide transcriptional activity (RNA-seq; GRO-seq), chromatin accessibility (DNase-seq, FAIRE-seq, MNase-seq), and more recently the three-dimensional organization of chromatin (Hi-C, ChIA-PET). In systems biology-based approaches several of these readouts are generally cumulated with the aim of describing living systems through a reconstitution of the genome-regulatory functions. However, an issue that is often underestimated is that conclusions drawn from such multidimensional analyses of NGS-derived datasets critically depend on the quality of the compared datasets. To address this problem, we have developed the NGS-QC Generator, a quality control system that infers quality descriptors for any kind of ChIP-sequencing and related datasets. In this chapter we provide a detailed protocol for (1) assessing quality descriptors with the NGS-QC Generator; (2) to interpret the generated reports; and (3) to explore the database of QC indicators (www.ngs-qc.org) for >21,000 publicly available datasets.",QualityControl,"ngsqc generator  quality control system  chipseq  relate deep sequencinggenerated datasets
 combination  massive parallel sequence   variety  modern dnarna enrichment technologies provide mean  interrogate functional proteingenome interactions chipseq genomewide transcriptional activity rnaseq groseq chromatin accessibility dnaseseq faireseq mnaseseq   recently  threedimensional organization  chromatin hic chiapet  systems biologybased approach several   readouts  generally cumulate   aim  describe live systems   reconstitution   genomeregulatory function however  issue   often underestimate   conclusions draw   multidimensional analyse  ngsderived datasets critically depend   quality   compare datasets  address  problem   develop  ngsqc generator  quality control system  infer quality descriptors   kind  chipsequencing  relate datasets   chapter  provide  detail protocol   assess quality descriptors   ngsqc generator   interpret  generate report    explore  database   indicators wwwngsqcorg   publicly available datasets",8
177,EasyQC,"EasyQC: Tool with Interactive User Interface for Efficient Next-Generation Sequencing Data Quality Control
The advent of next-generation sequencing (NGS) technologies has revolutionized the world of genomic research. Millions of sequences are generated in a short period of time and they provide intriguing insights to the researcher. Many NGS platforms have evolved over a period of time and their efficiency has been ever increasing. Still, primarily because of the chemistry, glitch in the sequencing machine and human handling errors, some artifacts tend to exist in the final sequence data set. These sequence errors have a profound impact on the downstream analyses and may provide misleading information. Hence, filtering of these erroneous reads has become inevitable and myriad of tools are available for this purpose. However, many of them are accessible as a command line interface that requires the user to enter each command manually. Here, we report EasyQC, a tool for NGS data quality control (QC) with a graphical user interface providing options to carry out trimming of NGS reads based on quality, length, homopolymer, and ambiguous bases. EasyQC also possesses features such as format converter, paired end merger, adapter trimmer, and a graph generator that generates quality distribution, length distribution, GC content, and base composition graphs. Comparison of raw and processed sequence data sets using EasyQC suggested significant increase in overall quality of the sequences. Testing of EasyQC using NGS data sets on a standalone desktop proved to be relatively faster. EasyQC is developed using PERL modules and can be executed in Windows and Linux platforms. With the various QC features, easy interface for end users, and cross-platform compatibility, EasyQC would be a valuable addition to the already existing tools facilitating better downstream analyses.",QualityControl,"easyqc tool  interactive user interface  efficient nextgeneration sequence data quality control
 advent  nextgeneration sequence ngs technologies  revolutionize  world  genomic research millions  sequence  generate   short period  time   provide intrigue insights   researcher many ngs platforms  evolve   period  time   efficiency   ever increase still primarily    chemistry glitch   sequence machine  human handle errors  artifacts tend  exist   final sequence data set  sequence errors   profound impact   downstream analyse  may provide mislead information hence filter   erroneous read  become inevitable  myriad  tool  available   purpose however many    accessible   command line interface  require  user  enter  command manually   report easyqc  tool  ngs data quality control    graphical user interface provide options  carry  trim  ngs read base  quality length homopolymer  ambiguous base easyqc also possess feature   format converter pair end merger adapter trimmer   graph generator  generate quality distribution length distribution  content  base composition graph comparison  raw  process sequence data set use easyqc suggest significant increase  overall quality   sequence test  easyqc use ngs data set   standalone desktop prove   relatively faster easyqc  develop use perl modules    execute  windows  linux platforms   various  feature easy interface  end users  crossplatform compatibility easyqc would   valuable addition   already exist tool facilitate better downstream analyse",8
178,FastQ Screen,"FastQ Screen: A tool for multi-genome mapping and quality control
DNA sequencing analysis typically involves mapping reads to just one reference genome. Mapping against multiple genomes is necessary, however, when the genome of origin requires confirmation. Mapping against multiple genomes is also advisable for detecting contamination or for identifying sample swaps which, if left undetected, may lead to incorrect experimental conclusions. Consequently, we present FastQ Screen, a tool to validate the origin of DNA samples by quantifying the proportion of reads that map to a panel of reference genomes. FastQ Screen is intended to be used routinely as a quality control measure and for analysing samples in which the origin of the DNA is uncertain or has multiple sources.",QualityControl,"fastq screen  tool  multigenome map  quality control
dna sequence analysis typically involve map read   one reference genome map  multiple genomes  necessary however   genome  origin require confirmation map  multiple genomes  also advisable  detect contamination   identify sample swap   leave undetected may lead  incorrect experimental conclusions consequently  present fastq screen  tool  validate  origin  dna sample  quantify  proportion  read  map   panel  reference genomes fastq screen  intend   use routinely   quality control measure   analyse sample    origin   dna  uncertain   multiple source",8
179,antiSMASH,"antiSMASH: rapid identification, annotation and analysis of secondary metabolite biosynthesis gene clusters in bacterial and fungal genome sequences
Bacterial and fungal secondary metabolism is a rich source of novel bioactive compounds with potential pharmaceutical applications as antibiotics, anti-tumor drugs or cholesterol-lowering drugs. To find new drug candidates, microbiologists are increasingly relying on sequencing genomes of a wide variety of microbes. However, rapidly and reliably pinpointing all the potential gene clusters for secondary metabolites in dozens of newly sequenced genomes has been extremely challenging, due to their biochemical heterogeneity, the presence of unknown enzymes and the dispersed nature of the necessary specialized bioinformatics tools and resources. Here, we present antiSMASH (antibiotics & Secondary Metabolite Analysis Shell), the first comprehensive pipeline capable of identifying biosynthetic loci covering the whole range of known secondary metabolite compound classes (polyketides, non-ribosomal peptides, terpenes, aminoglycosides, aminocoumarins, indolocarbazoles, lantibiotics, bacteriocins, nucleosides, beta-lactams, butyrolactones, siderophores, melanins and others). It aligns the identified regions at the gene cluster level to their nearest relatives from a database containing all other known gene clusters, and integrates or cross-links all previously available secondary-metabolite specific gene analysis methods in one interactive view. antiSMASH is available at http://antismash.secondarymetabolites.org .",Annotation,"antismash rapid identification annotation  analysis  secondary metabolite biosynthesis gene cluster  bacterial  fungal genome sequences
bacterial  fungal secondary metabolism   rich source  novel bioactive compound  potential pharmaceutical applications  antibiotics antitumor drug  cholesterollowering drug  find new drug candidates microbiologists  increasingly rely  sequence genomes   wide variety  microbes however rapidly  reliably pinpoint   potential gene cluster  secondary metabolites  dozens  newly sequence genomes   extremely challenge due   biochemical heterogeneity  presence  unknown enzymes   disperse nature   necessary specialize bioinformatics tool  resources   present antismash antibiotics  secondary metabolite analysis shell  first comprehensive pipeline capable  identify biosynthetic loci cover  whole range  know secondary metabolite compound class polyketides nonribosomal peptides terpenes aminoglycosides aminocoumarins indolocarbazoles lantibiotics bacteriocins nucleosides betalactams butyrolactones siderophores melanins  others  align  identify regions   gene cluster level   nearest relatives   database contain   know gene cluster  integrate  crosslinks  previously available secondarymetabolite specific gene analysis methods  one interactive view antismash  available   ",9
