,File_Name,Content,Category,Content_Parsed,Category_Code
57,Decontaminer,"DecontaMiner: A Pipeline for the Detection and Analysis of Contaminating Sequences in Human NGS Sequencing Data
Reads alignment is an essential step of next generation sequencing) data analyses. One challenging issue is represented by unmapped reads that are usually discarded and considered as not informative. Instead, it is important to fully understand the source of those reads, to assess the quality of the whole experiment. Moreover, it is of interest to get some insights on possible “contamination” from non-human sequences (e.g., viruses, bacteria, and fungi). Contamination may take place during the experimental procedures leading to sequencing, or be due to the presence of microorganisms infecting the sampled tissues. Here we propose a pipeline for the detection of viral, bacterial, and fungi contamination in human sequenced data. Similarities between input reads (query) and putative contaminating organism sequences (subject) are detected using a local alignment strategy (MegaBLAST). For each organism database DecontaMiner provides two main output files: one containing all the reads matching only a single organism; the second one containing the “ambiguous” matching reads. In both files, data is sorted by organism and classified by taxonomic group. Low quality, unaligned sequences, and those discarded by user criteria are also provided as output. Other information and summary statistics on the number of matched/filtered/discarded reads and organisms are generated. This pipeline has successfully detected foreign sequences in human Cancer RNA-seq data.",VirusDetection,"decontaminer  pipeline   detection  analysis  contaminate sequence  human ngs sequence data
reads alignment   essential step  next generation sequence data analyse one challenge issue  represent  unmapped read   usually discard  consider   informative instead   important  fully understand  source   read  assess  quality   whole experiment moreover    interest  get  insights  possible “contamination”  nonhuman sequence  viruses bacteria  fungi contamination may take place   experimental procedures lead  sequence   due   presence  microorganisms infect  sample tissue   propose  pipeline   detection  viral bacterial  fungi contamination  human sequence data similarities  input read query  putative contaminate organism sequence subject  detect use  local alignment strategy megablast   organism database decontaminer provide two main output file one contain   read match   single organism  second one contain  “ambiguous” match read   file data  sort  organism  classify  taxonomic group low quality unaligned sequence   discard  user criteria  also provide  output  information  summary statistics   number  matchedfiltereddiscarded read  organisms  generate  pipeline  successfully detect foreign sequence  human cancer rnaseq data",2
58,ART-DECO,"ART-DeCo: easy tool for detection and characterization of cross-contamination of DNA samples in diagnostic next-generation sequencing analysis
Next-generation sequencing (NGS) is routinely used for constitutional genetic analysis. However, cross-contamination between samples constitutes a major risk that could impact the results of the analysis. We have developed ART-DeCo, a tool using the allelic ratio (AR) of the Single Nucleotide Polymorphisms sequenced with regions of interest. When a sample is contaminated by DNA with a different genotype, unexpected ARs are obtained, which are in turn used for detection of contamination with a screening test, followed by identification and quantification of the contaminant. Following optimization, ART-DeCo was applied to 2222 constitutional DNA samples. The screening test was positive for 191 samples. In 33 cases (contamination percentages: 1.3% to 29.2%), the contaminant was identified and was mostly located in adjacent wells. Three other positive cases were due to barcoding errors or mixture of two DNA samples. Interestingly, the last contaminated sample corresponded to a bone marrow transplant recipient. Lastly, no contaminant was identified in 154 weakly positive ( < 4%) samples that were considered to be irrelevant to constitutional genetic analysis. ART-DeCo lends itself to mandatory quality control procedures, also highlighting the delicate steps of library preparation, resulting in practice improvement.",VirusDetection,"artdeco easy tool  detection  characterization  crosscontamination  dna sample  diagnostic nextgeneration sequence analysis
nextgeneration sequence ngs  routinely use  constitutional genetic analysis however crosscontamination  sample constitute  major risk  could impact  result   analysis   develop artdeco  tool use  allelic ratio    single nucleotide polymorphisms sequence  regions  interest   sample  contaminate  dna   different genotype unexpected ars  obtain    turn use  detection  contamination   screen test follow  identification  quantification   contaminant follow optimization artdeco  apply   constitutional dna sample  screen test  positive   sample   case contamination percentages     contaminant  identify   mostly locate  adjacent well three  positive case  due  barcoding errors  mixture  two dna sample interestingly  last contaminate sample correspond   bone marrow transplant recipient lastly  contaminant  identify   weakly positive    sample   consider   irrelevant  constitutional genetic analysis artdeco lend   mandatory quality control procedures also highlight  delicate step  library preparation result  practice improvement",2
59,PaPrBaG,"PaPrBaG: A machine learning approach for the detection of novel pathogens from NGS data
The reliable detection of novel bacterial pathogens from next-generation sequencing data is a key challenge for microbial diagnostics. Current computational tools usually rely on sequence similarity and often fail to detect novel species when closely related genomes are unavailable or missing from the reference database. Here we present the machine learning based approach PaPrBaG (Pathogenicity Prediction for Bacterial Genomes). PaPrBaG overcomes genetic divergence by training on a wide range of species with known pathogenicity phenotype. To that end we compiled a comprehensive list of pathogenic and non-pathogenic bacteria with human host, using various genome metadata in conjunction with a rule-based protocol. A detailed comparative study reveals that PaPrBaG has several advantages over sequence similarity approaches. Most importantly, it always provides a prediction whereas other approaches discard a large number of sequencing reads with low similarity to currently known reference genomes. Furthermore, PaPrBaG remains reliable even at very low genomic coverages. CombiningPaPrBaG with existing approaches further improves prediction results.",VirusDetection,"paprbag  machine learn approach   detection  novel pathogens  ngs data
 reliable detection  novel bacterial pathogens  nextgeneration sequence data   key challenge  microbial diagnostics current computational tool usually rely  sequence similarity  often fail  detect novel species  closely relate genomes  unavailable  miss   reference database   present  machine learn base approach paprbag pathogenicity prediction  bacterial genomes paprbag overcome genetic divergence  train   wide range  species  know pathogenicity phenotype   end  compile  comprehensive list  pathogenic  nonpathogenic bacteria  human host use various genome metadata  conjunction   rulebased protocol  detail comparative study reveal  paprbag  several advantage  sequence similarity approach  importantly  always provide  prediction whereas  approach discard  large number  sequence read  low similarity  currently know reference genomes furthermore paprbag remain reliable even   low genomic coverages combiningpaprbag  exist approach  improve prediction result",2
60,VirVarSeq,"VirVarSeq: a low-frequency virus variant detection pipeline for Illumina sequencing using adaptive base-calling accuracy filtering
In virology, massively parallel sequencing (MPS) opens many opportunities for studying viral quasi-species, e.g. in HIV-1- and HCV-infected patients. This is essential for understanding pathways to resistance, which can substantially improve treatment. Although MPS platforms allow in-depth characterization of sequence variation, their measurements still involve substantial technical noise. For Illumina sequencing, single base substitutions are the main error source and impede powerful assessment of low-frequency mutations. Fortunately, base calls are complemented with quality scores (Qs) that are useful for differentiating errors from the real low-frequency mutations. A variant calling tool, Q-cpileup, is proposed, which exploits the Qs of nucleotides in a filtering strategy to increase specificity. The tool is imbedded in an open-source pipeline, VirVarSeq, which allows variant calling starting from fastq files. Using both plasmid mixtures and clinical samples, we show that Q-cpileup is able to reduce the number of false-positive findings. The filtering strategy is adaptive and provides an optimized threshold for individual samples in each sequencing run. Additionally, linkage information is kept between single-nucleotide polymorphisms as variants are called at the codon level. This enables virologists to have an immediate biological interpretation of the reported variants with respect to their antiviral drug responses. A comparison with existing SNP caller tools reveals that calling variants at the codon level with Q-cpileup results in an outstanding sensitivity while maintaining a good specificity for variants with frequencies down to 0.5%.",VirusDetection,"virvarseq  lowfrequency virus variant detection pipeline  illumina sequence use adaptive basecalling accuracy filtering
 virology massively parallel sequence mps open many opportunities  study viral quasispecies   hiv  hcvinfected patients   essential  understand pathways  resistance   substantially improve treatment although mps platforms allow indepth characterization  sequence variation  measurements still involve substantial technical noise  illumina sequence single base substitutions   main error source  impede powerful assessment  lowfrequency mutations fortunately base call  complement  quality score    useful  differentiate errors   real lowfrequency mutations  variant call tool qcpileup  propose  exploit    nucleotides   filter strategy  increase specificity  tool  imbed   opensource pipeline virvarseq  allow variant call start  fastq file use  plasmid mixtures  clinical sample  show  qcpileup  able  reduce  number  falsepositive find  filter strategy  adaptive  provide  optimize threshold  individual sample   sequence run additionally linkage information  keep  singlenucleotide polymorphisms  variants  call   codon level  enable virologists    immediate biological interpretation   report variants  respect   antiviral drug responses  comparison  exist snp caller tool reveal  call variants   codon level  qcpileup result   outstanding sensitivity  maintain  good specificity  variants  frequencies   ",2
61,Giant Virus Finder,"The ""Giant Virus Finder"" discovers an abundance of giant viruses in the Antarctic dry valleys
Mimivirus was identified in 2003 from a biofilm of anindustrial water-cooling tower in England. Later, numerous new giant viruses were found in oceans and freshwater habitats, some of them having 2,500 genes.We have demonstrated their likely presence in four soil samples taken from the Kutch Desert (Gujarat, India). Here we describe a bioinformatics work-flow, called the ‘‘Giant Virus Finder’’ that is capable of discovering the likely presence ofthe genomes of giant viruses in metagenomic shotgun-sequenced datasets. The new workflow is applied to numerous hot and cold desert soil samples as well as some tundra- and forest soils.We show that most of these samples contain giant viruses, especially in the Antarctic dry valleys. The results imply that giant viruses could be frequent not only in aqueous habitats, but in a wide spectrum of soils on our planet.",VirusDetection," ""giant virus finder"" discover  abundance  giant viruses   antarctic dry valleys
mimivirus  identify     biofilm  anindustrial watercooling tower  england later numerous new giant viruses  find  oceans  freshwater habitats      geneswe  demonstrate  likely presence  four soil sample take   kutch desert gujarat india   describe  bioinformatics workflow call  giant virus finder   capable  discover  likely presence ofthe genomes  giant viruses  metagenomic shotgunsequenced datasets  new workflow  apply  numerous hot  cold desert soil sample  well   tundra  forest soilswe show     sample contain giant viruses especially   antarctic dry valleys  result imply  giant viruses could  frequent    aqueous habitats    wide spectrum  soil   planet",2
62,IMSA,"IMSA: Integrated Metagenomic Sequence Analysis for Identification of Exogenous Reads in a Host Genomic Background
Metagenomics, the study of microbial genomes within diverse environments, is a rapidly developing field. The identification of microbial sequences within a host organism enables the study of human intestinal, respiratory, and skin microbiota, and has allowed the identification of novel viruses in diseases such as Merkel cell carcinoma. There are few publicly available tools for metagenomic high throughput sequence analysis. We present Integrated Metagenomic Sequence Analysis (IMSA), a flexible, fast, and robust computational analysis pipeline that is available for public use. IMSA takes input sequence from high throughput datasets and uses a user-defined host database to filter out host sequence. IMSA then aligns the filtered reads to a user-defined universal database to characterize exogenous reads within the host background. IMSA assigns a score to each node of the taxonomy based on read frequency, and can output this as a taxonomy report suitable for cluster analysis or as a taxonomy map (TaxMap). IMSA also outputs the specific sequence reads assigned to a taxon of interest for downstream analysis. We demonstrate the use of IMSA to detect pathogens and normal flora within sequence data from a primary human cervical cancer carrying HPV16, a primary human cutaneous squamous cell carcinoma carrying HPV 16, the CaSki cell line carrying HPV16, and the HeLa cell line carrying HPV18.",VirusDetection,"imsa integrate metagenomic sequence analysis  identification  exogenous read   host genomic background
metagenomics  study  microbial genomes within diverse environments   rapidly develop field  identification  microbial sequence within  host organism enable  study  human intestinal respiratory  skin microbiota   allow  identification  novel viruses  diseases   merkel cell carcinoma    publicly available tool  metagenomic high throughput sequence analysis  present integrate metagenomic sequence analysis imsa  flexible fast  robust computational analysis pipeline   available  public use imsa take input sequence  high throughput datasets  use  userdefined host database  filter  host sequence imsa  align  filter read   userdefined universal database  characterize exogenous read within  host background imsa assign  score   node   taxonomy base  read frequency   output    taxonomy report suitable  cluster analysis    taxonomy map taxmap imsa also output  specific sequence read assign   taxon  interest  downstream analysis  demonstrate  use  imsa  detect pathogens  normal flora within sequence data   primary human cervical cancer carry hpv16  primary human cutaneous squamous cell carcinoma carry hpv   caski cell line carry hpv16   hela cell line carry hpv18",2
63,DeepVirFinder,"Identifying viruses from metagenomic data using deep learning
The recent development of metagenomic sequencing makes it possible to massively sequence microbial genomes including viral genomes without the need for laboratory culture. Existing reference-based and gene homology-based methods are not efﬁcient in identifying unknown viruses or short viral sequences from metagenomic data. Methods: Here we developed a reference-free and alignment-free machine learning method, DeepVirFinder, for identifying viral sequences in metagenomic data using deep learning. Trained based on sequences from viral RefSeq discovered before May 2015, and evaluated on those discovered after that date, DeepVirFinder outperformed the state-of-the-art method VirFinder at all contig lengths, achieving AUROC 0.93, 0.95, 0.97, and 0.98 for 300, 500, 1000, and 3000 bp sequences respectively. Enlarging the training data with additional millions of puriﬁed viral sequences from metavirome samples further improved the accuracy for identifying virus groups that are under-represented. Applying DeepVirFinder to real human gut metagenomic samples, we identiﬁed 51,138 viral sequences belonging to 175 bins in patients with colorectal carcinoma (CRC). Ten bins were found associated with the cancer status, suggesting viruses may play important roles in CRC. Powered by deep learning and high throughput sequencing metagenomic data, DeepVirFinder signiﬁcantly improved the accuracy of viral identiﬁcation and will assist the study of viruses in the era of metagenomics.",VirusIdentification,"identify viruses  metagenomic data use deep learning
 recent development  metagenomic sequence make  possible  massively sequence microbial genomes include viral genomes without  need  laboratory culture exist referencebased  gene homologybased methods   efﬁcient  identify unknown viruses  short viral sequence  metagenomic data methods   develop  referencefree  alignmentfree machine learn method deepvirfinder  identify viral sequence  metagenomic data use deep learn train base  sequence  viral refseq discover  may   evaluate   discover   date deepvirfinder outperform  stateoftheart method virfinder   contig lengths achieve auroc             sequence respectively enlarge  train data  additional millions  puriﬁed viral sequence  metavirome sample  improve  accuracy  identify virus group   underrepresented apply deepvirfinder  real human gut metagenomic sample  identiﬁed  viral sequence belong   bin  patients  colorectal carcinoma crc ten bin  find associate   cancer status suggest viruses may play important roles  crc power  deep learn  high throughput sequence metagenomic data deepvirfinder signiﬁcantly improve  accuracy  viral identiﬁcation   assist  study  viruses   era  metagenomics",3
64,ViraMiner,"ViraMiner: Deep learning on raw DNA sequences for identifying viral genomes in human samples
Despite its clinical importance, detection of highly divergent or yet unknown viruses is a major challenge. When human samples are sequenced, conventional alignments classify many assembled contigs as “unknown” since many of the sequences are not similar to known genomes. In this work, we developed ViraMiner, a deep learning-based method to identify viruses in various human biospecimens. ViraMiner contains two branches of Convolutional Neural Networks designed to detect both patterns and pattern-frequencies on raw metagenomics contigs. The training dataset included sequences obtained from 19 metagenomic experiments which were analyzed and labeled by BLAST. The model achieves significantly improved accuracy compared to other machine learning methods for viral genome classification. Using 300 bp contigs ViraMiner achieves 0.923 area under the ROC curve. To our knowledge, this is the first machine learning methodology that can detect the presence of viral sequences among raw metagenomic contigs from diverse human samples. We suggest that the proposed model captures different types of information of genome composition, and can be used as a recommendation system to further investigate sequences labeled as “unknown” by conventional alignment methods. Exploring these highly-divergent viruses, in turn, can enhance our knowledge of infectious causes of diseases.",VirusIdentification,"viraminer deep learn  raw dna sequence  identify viral genomes  human samples
despite  clinical importance detection  highly divergent  yet unknown viruses   major challenge  human sample  sequence conventional alignments classify many assemble contigs  “unknown” since many   sequence   similar  know genomes   work  develop viraminer  deep learningbased method  identify viruses  various human biospecimens viraminer contain two branch  convolutional neural network design  detect  pattern  patternfrequencies  raw metagenomics contigs  train dataset include sequence obtain   metagenomic experiment   analyze  label  blast  model achieve significantly improve accuracy compare   machine learn methods  viral genome classification use   contigs viraminer achieve  area   roc curve   knowledge    first machine learn methodology   detect  presence  viral sequence among raw metagenomic contigs  diverse human sample  suggest   propose model capture different type  information  genome composition    use   recommendation system   investigate sequence label  “unknown”  conventional alignment methods explore  highlydivergent viruses  turn  enhance  knowledge  infectious cause  diseases",3
