,File_Name,Content,Category,Content_Parsed,Category_Code
107,SSAKE,"Assembling millions of short DNA sequences using SSAKE.
Novel DNA sequencing technologies with the potential for up to three orders magnitude more sequence throughput than conventional Sanger sequencing are emerging. The instrument now available from Solexa Ltd, produces millions of short DNA sequences of 25 nt each. Due to ubiquitous repeats in large genomes and the inability of short sequences to uniquely and unambiguously characterize them, the short read length limits applicability for de novo sequencing. However, given the sequencing depth and the throughput of this instrument, stringent assembly of highly identical sequences can be achieved. We describe SSAKE, a tool for aggressively assembling millions of short nucleotide sequences by progressively searching through a prefix tree for the longest possible overlap between any two sequences. SSAKE is designed to help leverage the information from short sequence reads by stringently assembling them into contiguous sequences that can be used to characterize novel sequencing targets.",Assembly,"assemble millions  short dna sequence use ssake
novel dna sequence technologies   potential    three order magnitude  sequence throughput  conventional sanger sequence  emerge  instrument  available  solexa ltd produce millions  short dna sequence     due  ubiquitous repeat  large genomes   inability  short sequence  uniquely  unambiguously characterize   short read length limit applicability   novo sequence however give  sequence depth   throughput   instrument stringent assembly  highly identical sequence   achieve  describe ssake  tool  aggressively assemble millions  short nucleotide sequence  progressively search   prefix tree   longest possible overlap   two sequence ssake  design  help leverage  information  short sequence read  stringently assemble   contiguous sequence    use  characterize novel sequence target",5
108,GAML,"GAML: Genome Assembly by Maximum Likelihood
Resolution of repeats and scaffolding of shorter contigs are critical parts of genome assembly. Modern assemblers usually perform such steps by heuristics, often tailored to a particular technology for producing paired or long reads. We propose a new framework that allows systematic combination of diverse sequencing datasets into a single assembly. We achieve this by searching for an assembly with the maximum likelihood in a probabilistic model capturing error rate, insert lengths, and other characteristics of the sequencing technology used to produce each dataset. We have implemented a prototype genome assembler GAML that can use any combination of insert sizes with Illumina or 454 reads, as well as PacBio reads. Our experiments show that we can assemble short genomes with N50 sizes and error rates comparable to ALLPATHS-LG or Cerulean. While ALLPATHS-LG and Cerulean require each a specific combination of datasets, GAML works on any combination. We have introduced a new probabilistic approach to genome assembly and demonstrated that this approach can lead to superior results when used to combine diverse set of datasets from different sequencing technologies.",Assembly,"gaml genome assembly  maximum likelihood
resolution  repeat  scaffold  shorter contigs  critical part  genome assembly modern assemblers usually perform  step  heuristics often tailor   particular technology  produce pair  long read  propose  new framework  allow systematic combination  diverse sequence datasets   single assembly  achieve   search   assembly   maximum likelihood   probabilistic model capture error rate insert lengths   characteristics   sequence technology use  produce  dataset   implement  prototype genome assembler gaml   use  combination  insert size  illumina   read  well  pacbio read  experiment show    assemble short genomes  n50 size  error rat comparable  allpathslg  cerulean  allpathslg  cerulean require   specific combination  datasets gaml work   combination   introduce  new probabilistic approach  genome assembly  demonstrate   approach  lead  superior result  use  combine diverse set  datasets  different sequence technologies",5
109,SKESA,"SKESA: strategic k-mer extension for scrupulous assemblies
SKESA is a DeBruijn graph-based de-novo assembler designed for assembling reads of microbial genomes sequenced using Illumina. Comparison with SPAdes and MegaHit shows that SKESA produces assemblies that have high sequence quality and contiguity, handles low-level contamination in reads, is fast, and produces an identical assembly for the same input when assembled multiple times with the same or different compute resources. SKESA has been used for assembling over 272,000 read sets in the Sequence Read Archive at NCBI and for real-time pathogen detection.",Assembly,"skesa strategic kmer extension  scrupulous assemblies
skesa   debruijn graphbased denovo assembler design  assemble read  microbial genomes sequence use illumina comparison  spade  megahit show  skesa produce assemblies   high sequence quality  contiguity handle lowlevel contamination  read  fast  produce  identical assembly    input  assemble multiple time     different compute resources skesa   use  assemble   read set   sequence read archive  ncbi   realtime pathogen detection",5
110,Euler-sr,"Short read fragment assembly of bacterial genomes
In the last year, high-throughput sequencing technologies have progressed from proof-of-concept to production quality. While these methods produce high-quality reads, they have yet to produce reads comparable in length to Sanger-based sequencing. Current fragment assembly algorithms have been implemented and optimized for mate-paired Sanger-based reads, and thus do not perform well on short reads produced by short read technologies. We present a new Eulerian assembler that generates nearly optimal short read assemblies of bacterial genomes and describe an approach to assemble reads in the case of the popular hybrid protocol when short and long Sanger-based reads are combined.",Assembly,"short read fragment assembly  bacterial genomes
  last year highthroughput sequence technologies  progress  proofofconcept  production quality   methods produce highquality read   yet  produce read comparable  length  sangerbased sequence current fragment assembly algorithms   implement  optimize  matepaired sangerbased read  thus   perform well  short read produce  short read technologies  present  new eulerian assembler  generate nearly optimal short read assemblies  bacterial genomes  describe  approach  assemble read   case   popular hybrid protocol  short  long sangerbased read  combine",5
111,ALLPATHS2,"ALLPATHS 2: small genomes assembled accurately and with high continuity from short paired reads
We demonstrate that genome sequences approaching finished quality can be generated from short paired reads. Using 36 base (fragment) and 26 base (jumping) reads from five microbial genomes of varied GC composition and sizes up to 40 Mb, ALLPATHS2 generated assemblies with long, accurate contigs and scaffolds. Velvet and EULER-SR were less accurate. For example, for Escherichia coli, the fraction of 10-kb stretches that were perfect was 99.8% (ALLPATHS2), 68.7% (Velvet), and 42.1% (EULER-SR).",Assembly,"allpaths  small genomes assemble accurately   high continuity  short pair reads
 demonstrate  genome sequence approach finish quality   generate  short pair read use  base fragment   base jump read  five microbial genomes  vary  composition  size     allpaths2 generate assemblies  long accurate contigs  scaffold velvet  eulersr  less accurate  example  escherichia coli  fraction   stretch   perfect   allpaths2  velvet   eulersr",5
112,VCAKE,"Extending assembly of short DNA sequences to handle error 
Inexpensive de novo genome sequencing, particularly in organisms with small genomes, is now possible using several new sequencing technologies. Some of these technologies such as that from Illumina's Solexa Sequencing, produce high genomic coverage by generating a very large number of small reads (∼30 bp). While prior work shows that partial assembly can be performed by k-mer extension in error-free reads, this algorithm is unsuccessful with the sequencing error rates found in practice. We present VCAKE (Verified Consensus Assembly by K-mer Extension), a modification of simple k-mer extension that overcomes error by using high depth coverage. Though it is a simple modification of a previous approach, we show significant improvements in assembly results on simulated and experimental datasets that include error.",Assembly,"extend assembly  short dna sequence  handle error 
inexpensive  novo genome sequence particularly  organisms  small genomes   possible use several new sequence technologies    technologies     illumina' solexa sequence produce high genomic coverage  generate   large number  small read    prior work show  partial assembly   perform  kmer extension  errorfree read  algorithm  unsuccessful   sequence error rat find  practice  present vcake verify consensus assembly  kmer extension  modification  simple kmer extension  overcome error  use high depth coverage though    simple modification   previous approach  show significant improvements  assembly result  simulate  experimental datasets  include error",5
113,SHARCGS,"SHARCGS, a fast and highly accurate short-read assembly algorithm for de novo genomic sequencing
The latest revolution in the DNA sequencing field has been brought about by the development of automated sequencers that are capable of generating giga base pair data sets quickly and at low cost. Applications of such technologies seem to be limited to resequencing and transcript discovery, due to the shortness of the generated reads. In order to extend the fields of application to de novo sequencing, we developed the SHARCGS algorithm to assemble short-read (25–40-mer) data with high accuracy and speed. The efficiency of SHARCGS was tested on BAC inserts from three eukaryotic species, on two yeast chromosomes, and on two bacterial genomes (Haemophilus influenzae, Escherichia coli). We show that 30-mer-based BAC assemblies have N50 sizes >20 kbp for Drosophila and Arabidopsis and >4 kbp for human in simulations taking missing reads and wrong base calls into account. We assembled 949,974 contigs with length >50 bp, and only one single contig could not be aligned error-free against the reference sequences. We generated 36-mer reads for the genome of Helicobacter acinonychis on the Illumina 1G sequencing instrument and assembled 937 contigs covering 98% of the genome with an N50 size of 3.7 kbp. With the exception of five contigs that differ in 1–4 positions relative to the reference sequence, all contigs matched the genome error-free. Thus, SHARCGS is a suitable tool for fully exploiting novel sequencing technologies by assembling sequence contigs de novo with high confidence and by outperforming existing assembly algorithms in terms of speed and accuracy.",Assembly,"sharcgs  fast  highly accurate shortread assembly algorithm   novo genomic sequencing
 latest revolution   dna sequence field   bring    development  automate sequencers   capable  generate giga base pair data set quickly   low cost applications   technologies seem   limit  resequencing  transcript discovery due   shortness   generate read  order  extend  field  application   novo sequence  develop  sharcgs algorithm  assemble shortread mer data  high accuracy  speed  efficiency  sharcgs  test  bac insert  three eukaryotic species  two yeast chromosomes   two bacterial genomes haemophilus influenzae escherichia coli  show  merbased bac assemblies  n50 size  kbp  drosophila  arabidopsis   kbp  human  simulations take miss read  wrong base call  account  assemble  contigs  length     one single contig could   align errorfree   reference sequence  generate mer read   genome  helicobacter acinonychis   illumina  sequence instrument  assemble  contigs cover    genome   n50 size   kbp   exception  five contigs  differ   position relative   reference sequence  contigs match  genome errorfree thus sharcgs   suitable tool  fully exploit novel sequence technologies  assemble sequence contigs  novo  high confidence   outperform exist assembly algorithms  term  speed  accuracy",5
114,Edena,"De novo bacterial genome sequencing: Millions of very short reads assembled on a desktop computer
Novel high-throughput DNA sequencing technologies allow researchers to characterize a bacterial genome during a single experiment and at a moderate cost. However, the increase in sequencing throughput that is allowed by using such platforms is obtained at the expense of individual sequence read length, which must be assembled into longer contigs to be exploitable. This study focuses on the Illumina sequencing platform that produces millions of very short sequences that are 35 bases in length. We propose a de novo assembler software that is dedicated to process such data. Based on a classical overlap graph representation and on the detection of potentially spurious reads, our software generates a set of accurate contigs of several kilobases that cover most of the bacterial genome. The assembly results were validated by comparing data sets that were obtained experimentally for Staphylococcus aureus strain MW2 and Helicobacter acinonychis strain Sheeba with that of their published genomes acquired by conventional sequencing of 1.5- to 3.0-kb fragments. We also provide indications that the broad coverage achieved by high-throughput sequencing might allow for the detection of clonal polymorphisms in the set of DNA molecules being sequenced.",Assembly," novo bacterial genome sequence millions   short read assemble   desktop computer
novel highthroughput dna sequence technologies allow researchers  characterize  bacterial genome   single experiment    moderate cost however  increase  sequence throughput   allow  use  platforms  obtain   expense  individual sequence read length  must  assemble  longer contigs   exploitable  study focus   illumina sequence platform  produce millions   short sequence    base  length  propose   novo assembler software   dedicate  process  data base   classical overlap graph representation    detection  potentially spurious read  software generate  set  accurate contigs  several kilobases  cover    bacterial genome  assembly result  validate  compare data set   obtain experimentally  staphylococcus aureus strain mw2  helicobacter acinonychis strain sheeba     publish genomes acquire  conventional sequence     fragment  also provide indications   broad coverage achieve  highthroughput sequence might allow   detection  clonal polymorphisms   set  dna molecules  sequence",5
115,IDBA-a,"IDBA – A Practical Iterative de Bruijn Graph De Novo Assembler
The de Bruijn graph assembly approach breaks reads into k-mers before assembling them into contigs. The string graph approach forms contigs by connecting two reads with k or more overlapping nucleotides. Both approaches must deal with the following problems: false-positive vertices, due to erroneous reads; gap problem, due to non-uniform coverage; branching problem, due to erroneous reads and repeat regions. A proper choice of k is crucial but for single k there is always a trade-off: a small k favors the situation of erroneous reads and non-uniform coverage, and a large k favors short repeat regions. We propose an iterative de Bruijn graph approach iterating from small to large k exploring the advantages of the in between values. Our IDBA outperforms the existing algorithms by constructing longer contigs with similar accuracy and using less memory, both with real and simulated data. The running time of the algorithm is comparable to existing algorithms.",Assembly,"idba   practical iterative  bruijn graph  novo assembler
  bruijn graph assembly approach break read  kmers  assemble   contigs  string graph approach form contigs  connect two read     overlap nucleotides  approach must deal   follow problems falsepositive vertices due  erroneous read gap problem due  nonuniform coverage branch problem due  erroneous read  repeat regions  proper choice    crucial   single    always  tradeoff  small  favor  situation  erroneous read  nonuniform coverage   large  favor short repeat regions  propose  iterative  bruijn graph approach iterate  small  large  explore  advantage     value  idba outperform  exist algorithms  construct longer contigs  similar accuracy  use less memory   real  simulate data  run time   algorithm  comparable  exist algorithms",5
116,IDBA-tran,"IDBA-tran: a more robust de novo de Bruijn graph assembler for transcriptomes with uneven expression levels.
RNA sequencing based on next-generation sequencing technology is effective for analyzing transcriptomes. Like de novo genome assembly, de novo transcriptome assembly does not rely on any reference genome or additional annotation information, but is more difficult. In particular, isoforms can have very uneven expression levels (e.g. 1:100), which make it very difficult to identify low-expressed isoforms. One challenge is to remove erroneous vertices/edges with high multiplicity (produced by high-expressed isoforms) in the de Bruijn graph without removing correct ones with not-so-high multiplicity from low-expressed isoforms. Failing to do so will result in the loss of low-expressed isoforms or having complicated subgraphs with transcripts of different genes mixed together due to erroneous vertices/edges. Unlike existing tools, which remove erroneous vertices/edges with multiplicities lower than a global threshold, we use a probabilistic progressive approach to iteratively remove them with local thresholds. This enables us to decompose the graph into disconnected components, each containing a few genes, if not a single gene, while retaining many correct vertices/edges of low-expressed isoforms. Combined with existing techniques, IDBA-Tran is able to assemble both high-expressed and low-expressed transcripts and outperform existing assemblers in terms of sensitivity and specificity for both simulated and real data.",Assembly,"idbatran   robust  novo  bruijn graph assembler  transcriptomes  uneven expression levels
rna sequence base  nextgeneration sequence technology  effective  analyze transcriptomes like  novo genome assembly  novo transcriptome assembly   rely   reference genome  additional annotation information    difficult  particular isoforms    uneven expression level    make   difficult  identify lowexpressed isoforms one challenge   remove erroneous verticesedges  high multiplicity produce  highexpressed isoforms    bruijn graph without remove correct ones  notsohigh multiplicity  lowexpressed isoforms fail     result   loss  lowexpressed isoforms   complicate subgraphs  transcripts  different genes mix together due  erroneous verticesedges unlike exist tool  remove erroneous verticesedges  multiplicities lower   global threshold  use  probabilistic progressive approach  iteratively remove   local thresholds  enable   decompose  graph  disconnect components  contain   genes    single gene  retain many correct verticesedges  lowexpressed isoforms combine  exist techniques idbatran  able  assemble  highexpressed  lowexpressed transcripts  outperform exist assemblers  term  sensitivity  specificity   simulate  real data",5
117,Meta-IDBA,"Meta-IDBA: a de Novo assembler for metagenomic data.
Next-generation sequencing techniques allow us to generate reads from a microbial environment in order to analyze the microbial community. However, assembling of a set of mixed reads from different species to form contigs is a bottleneck of metagenomic research. Although there are many assemblers for assembling reads from a single genome, there are no assemblers for assembling reads in metagenomic data without reference genome sequences. Moreover, the performances of these assemblers on metagenomic data are far from satisfactory, because of the existence of common regions in the genomes of subspecies and species, which make the assembly problem much more complicated. We introduce the Meta-IDBA algorithm for assembling reads in metagenomic data, which contain multiple genomes from different species. There are two core steps in Meta-IDBA. It first tries to partition the de Bruijn graph into isolated components of different species based on an important observation. Then, for each component, it captures the slight variants of the genomes of subspecies from the same species by multiple alignments and represents the genome of one species, using a consensus sequence. Comparison of the performances of Meta-IDBA and existing assemblers, such as Velvet and Abyss for different metagenomic datasets shows that Meta-IDBA can reconstruct longer contigs with similar accuracy.",Assembly,"metaidba   novo assembler  metagenomic data
nextgeneration sequence techniques allow   generate read   microbial environment  order  analyze  microbial community however assemble   set  mix read  different species  form contigs   bottleneck  metagenomic research although   many assemblers  assemble read   single genome    assemblers  assemble read  metagenomic data without reference genome sequence moreover  performances   assemblers  metagenomic data  far  satisfactory    existence  common regions   genomes  subspecies  species  make  assembly problem much  complicate  introduce  metaidba algorithm  assemble read  metagenomic data  contain multiple genomes  different species   two core step  metaidba  first try  partition   bruijn graph  isolate components  different species base   important observation    component  capture  slight variants   genomes  subspecies    species  multiple alignments  represent  genome  one species use  consensus sequence comparison   performances  metaidba  exist assemblers   velvet  aby  different metagenomic datasets show  metaidba  reconstruct longer contigs  similar accuracy",5
118,IDBA-UD,"IDBA-UD: a de novo assembler for single-cell and metagenomic sequencing data with highly uneven depth
Next-generation sequencing allows us to sequence reads from a microbial environment using single-cell sequencing or metagenomic sequencing technologies. However, both technologies suffer from the problem that sequencing depth of different regions of a genome or genomes from different species are highly uneven. Most existing genome assemblers usually have an assumption that sequencing depths are even. These assemblers fail to construct correct long contigs. We introduce the IDBA-UD algorithm that is based on the de Bruijn graph approach for assembling reads from single-cell sequencing or metagenomic sequencing technologies with uneven sequencing depths. Several non-trivial techniques have been employed to tackle the problems. Instead of using a simple threshold, we use multiple depthrelative thresholds to remove erroneous k-mers in both low-depth and high-depth regions. The technique of local assembly with paired-end information is used to solve the branch problem of low-depth short repeat regions. To speed up the process, an error correction step is conducted to correct reads of high-depth regions that can be aligned to highconfident contigs. Comparison of the performances of IDBA-UD and existing assemblers (Velvet, Velvet-SC, SOAPdenovo and Meta-IDBA) for different datasets, shows that IDBA-UD can reconstruct longer contigs with higher accuracy.",Assembly,"idbaud   novo assembler  singlecell  metagenomic sequence data  highly uneven depth
nextgeneration sequence allow   sequence read   microbial environment use singlecell sequence  metagenomic sequence technologies however  technologies suffer   problem  sequence depth  different regions   genome  genomes  different species  highly uneven  exist genome assemblers usually   assumption  sequence depths  even  assemblers fail  construct correct long contigs  introduce  idbaud algorithm   base    bruijn graph approach  assemble read  singlecell sequence  metagenomic sequence technologies  uneven sequence depths several nontrivial techniques   employ  tackle  problems instead  use  simple threshold  use multiple depthrelative thresholds  remove erroneous kmers   lowdepth  highdepth regions  technique  local assembly  pairedend information  use  solve  branch problem  lowdepth short repeat regions  speed   process  error correction step  conduct  correct read  highdepth regions    align  highconfident contigs comparison   performances  idbaud  exist assemblers velvet velvetsc soapdenovo  metaidba  different datasets show  idbaud  reconstruct longer contigs  higher accuracy",5
